file,category,keyword_match_score
He is clenching his fists and striding forward with his head held high.csv,Uncategorized,0
He is cooking.csv,Occupational/Work Movements,1
He is crossing his arms.csv,Basic Movements,1
He is decocting medicine.csv,Uncategorized,0
He is doing Romanian deadlifts.csv,Basic Movements,1
He is doing a direct and unwavering straight swing..csv,Object/Tool-Use Movements,1
He is doing a front jab and a front hand uppercut..csv,Sports Movements,2
"He is doing a front thrust, a rear straight, a rear straight..csv",Uncategorized,0
He is doing a jab punch..csv,Sports Movements,1
He is doing a two-hand knee lift and press jump..csv,Basic Movements,2
He is doing an elevation jump..csv,Basic Movements,1
He is doing body rotation exercise.csv,Sports Movements,1
He is doing chest expansion exercises.csv,Sports Movements,1
He is doing contralateral high knee jumps..csv,Basic Movements,1
He is doing cool-down exercises.csv,Sports Movements,1
He is doing dumbbell lateral raises.csv,Sports Movements,1
"He is doing front hook, back hook, front hook, and back straight..csv",Uncategorized,0
"He is doing front straight dodge, back straight front straight back straight..csv",Uncategorized,0
"He is doing front thrust, rear straight, front hand uppercut..csv",Sports Movements,1
He is doing jumping exercises.csv,Sports Movements,1
"He is doing lead hand head strike, lead hand body strike, and rear straight punch..csv",Uncategorized,0
"He is doing left and right straight changes of direction, front hook..csv",Uncategorized,0
"He is doing left and right straight swings, rocking and dodging, and front hooks..csv",Uncategorized,0
He is doing leg kicks.csv,Uncategorized,0
He is doing physical fitness testing.csv,Uncategorized,0
"He is doing straight hook and straight swing, back hook and front swing..csv",Uncategorized,0
He is doing stretching exercises.csv,Sports Movements,1
He is doing the duck walk squat.csv,Basic Movements,2
He is dragging his feet forward.csv,Uncategorized,0
He is drawing.csv,Uncategorized,0
He is dribbling the ball forward.csv,Sports Movements,1
He is dribbling the basketball.csv,Sports Movements,2
He is drinking cola.csv,Uncategorized,0
He is eating corn.csv,Uncategorized,0
He is feeding pig feed and raising many chicks..csv,Uncategorized,0
He is folding clothes.csv,Daily-Life & Household Movements,1
He is gesturing while talking on the phone.csv,Social/Expressive Movements,1
He is giving a PPT presentation in the meeting room.csv,Daily-Life & Household Movements,1
He is guessing riddles.csv,Uncategorized,0
He is holding a compass to determine the direction for the hike.csv,Object/Tool-Use Movements,2
"He is holding a selfie stick, rotating 360 degrees to take photos..csv",Object/Tool-Use Movements,2
"He is holding a sign, waving his right hand, protesting the resolution.csv",Object/Tool-Use Movements,2
He is imitating the baboon_s chest-beating action..csv,Imitation/Character Movements,1
He is kicking a shuttlecock.csv,Uncategorized,0
He is lifting dumbbells.csv,Sports Movements,1
He is lighting a sparkler.csv,Uncategorized,0
"He is like a Tyrannosaurus Rex in the forest, clenching his claws, raising his head and sniffing the surrounding air..csv",Imitation/Character Movements,2
He is looking at his watch and distant vehicles at the bus stop.csv,Uncategorized,0
He is making a phone call.csv,Uncategorized,0
He is making a self-criticism on the podium.csv,Uncategorized,0
He is making an overwhelming move.csv,Object/Tool-Use Movements,1
He is patiently waiting for the bus at the bus stop.csv,Medical/Care/Safety Movements,1
"He is performing a front straight lateral lunge, then a back straight..csv",Uncategorized,0
He is performing a standing dumbbell press.csv,Basic Movements,2
He is performing bent-over dumbbell rows.csv,Sports Movements,1
He is performing combination dumbbell curls.csv,Sports Movements,1
He is performing dumbbell squats.csv,Sports Movements,1
He is performing unilateral dumbbell row training.csv,Sports Movements,2
"He is physically weak, holding onto the table to walk.csv",Object/Tool-Use Movements,2
He is picking tea leaves.csv,Object/Tool-Use Movements,1
He is playing a finger guessing game with the other party.csv,Uncategorized,0
He is playing football on the playground.csv,Uncategorized,0
He is playing golf.csv,Sports Movements,1
He is practicing Left Grasping the Sparrow_s Tail in Tai Chi.csv,Sports Movements,2
He is practicing Playing the Pipa in Tai Chi..csv,Sports Movements,2
He is practicing Right Grasping the Sparrow_s Tail in Tai Chi..csv,Sports Movements,2
"He is practicing left and right straight dodges, and rear straight punches..csv",Uncategorized,0
He is practicing long jump on the playground.csv,Sports Movements,2
He is practicing the Apparent Closure in Tai Chi..csv,Sports Movements,2
"He is practicing the Ba Duan Jin movement of drawing the bow left and right, like shooting an eagle..csv",Combat & Tactical Movements,1
He is practicing the Baduanjin exercise Regulating the Spleen and Stomach Requires a Single Arm Raise..csv,Sports Movements,2
He is practicing the Double Peaks Piercing Ears in Tai Chi..csv,Sports Movements,2
He is practicing the Left and Right Reverse Reeling Arm in Tai Chi..csv,Sports Movements,2
He is practicing the Left and Right Wild Horse Parts Its Mane in Tai Chi.csv,Sports Movements,2
He is practicing the Two Hands Hold Up the Heavens movement in Baduanjin to regulate the Triple Burner.csv,Object/Tool-Use Movements,2
He is practicing the opening form of Tai Chi.csv,Sports Movements,2
"He is practicing, lifting his hands up and then lowering them.csv",Basic Movements,2
He is race walking on the sports field.csv,Basic Movements,2
He is regretting his own cowardice.csv,Uncategorized,0
He is rolling the basketball in his hands.csv,Sports Movements,1
He is rolling up the scattered toilet paper..csv,Daily-Life & Household Movements,3
He is rubbing his hands.csv,Uncategorized,0
He is running with great effort..csv,Basic Movements,2
He is scratching his head.csv,Uncategorized,0
He is searching for an ancient book on the library_s bookshelf.csv,Daily-Life & Household Movements,1
He is shaking his head.csv,Uncategorized,0
He is shooting a basket.csv,Combat & Tactical Movements,1
He is shooting an arrow.csv,Combat & Tactical Movements,1
He is shoveling coal.csv,Object/Tool-Use Movements,1
He is skipping stones with pebbles.csv,Uncategorized,0
He is sowing seeds.csv,Object/Tool-Use Movements,1
He is spearfishing in the river.csv,Uncategorized,0
He is spinning a hula hoop.csv,Uncategorized,0
He is spraying pesticide.csv,Object/Tool-Use Movements,1
He is squeezing the balloon.csv,Uncategorized,0
He is standing lifting one leg to the right.csv,Basic Movements,3
"He is standing on the podium, displaying his research results.csv",Basic Movements,2
"He is standing on the station platform, waiting for the soon-to-arrive train.csv",Basic Movements,2
He is standing raising one leg forward.csv,Basic Movements,2
He is standing with his hands at his sides.csv,Basic Movements,2
"He is stepping on the sand on the beach, the sun is too strong, so he covers his eyes with both hands.csv",Basic Movements,1
He is sweeping the floor with a broom.csv,Daily-Life & Household Movements,3
He is swinging his arms and stepping in place.csv,Object/Tool-Use Movements,1
He is taking care of the new colleague.csv,Uncategorized,0
He is taking care of the new colleague_1.csv,Uncategorized,0
"He is tilting his head, his left hand pressing the strings, and his right hand playing the violin..csv",Uncategorized,0
He is transferring files.csv,Object/Tool-Use Movements,1
He is transferring files_1.csv,Object/Tool-Use Movements,1
He is walking while holding the glass.csv,Object/Tool-Use Movements,2
He is wallowing in self-pity.csv,Uncategorized,0
He is washing the pot.csv,Daily-Life & Household Movements,2
"He is watering flowers on the balcony, sprinkling water on them little by little by hand.csv",Daily-Life & Household Movements,2
He is waving at the other person.csv,Uncategorized,0
"He is wearing an apron, preparing to cook.csv",Occupational/Work Movements,1
He is wiping the glass.csv,Uncategorized,0
He jogged all the way to hand out flyers to passers-by.csv,Uncategorized,0
He jump squatted once..csv,Basic Movements,3
He jumped to avoid the puddle.csv,Basic Movements,1
He jumps like a kangaroo.csv,Imitation/Character Movements,2
He jumps like a rabbit.csv,Imitation/Character Movements,2
"He just won the game, we warmly congratulate him.csv",Uncategorized,0
He keeps drinking water to replenish his hydration..csv,Daily-Life & Household Movements,1
He kept dribbling the basketball left and right..csv,Sports Movements,2
He kept rubbing the wad of paper.csv,Uncategorized,0
He kept spinning in the room.csv,Daily-Life & Household Movements,1
He kept the precious photos in the safe and locked it.csv,Object/Tool-Use Movements,1
"He kept waving a red ribbon by the roadside, sending out a distress signal.csv",Uncategorized,0
He kept wiping his nose with tissues because of a cold.csv,Uncategorized,0
He kicked down the wooden fence.csv,Uncategorized,0
He kicked forward.csv,Uncategorized,0
He kicked open the obstacle.csv,Object/Tool-Use Movements,1
"He kicked the wall to vent his inner dissatisfaction, and his hand also punched once.csv",Uncategorized,0
He knocked down the container on the table with a stick.csv,Daily-Life & Household Movements,1
"He knocked the opponent to the ground with a hook punch, grabbed their collar and continued to beat them..csv",Uncategorized,0
He laughed out loud happily.csv,Social/Expressive Movements,1
He leaned back against the corridor wall with his hands in his pockets.csv,Basic Movements,1
"He leaned closer to the TV, not wanting to miss any detail of the football game.csv",Object/Tool-Use Movements,1
"He leaned closer to the flower, took a deep breath of the floral fragrance.csv",Basic Movements,2
He leaned closer to the food and contentedly smelled its aroma.csv,Object/Tool-Use Movements,1
"He leaned on the window, bending over to listen intently.csv",Basic Movements,3
"He leans by the window, listening carefully.csv",Basic Movements,1
He leans his head out the window.csv,Basic Movements,1
He leaped into the air and crossed the wide trench.csv,Basic Movements,1
He led the choir into the song_s melody.csv,Uncategorized,0
He leisurely strolled along the winding path..csv,Basic Movements,1
He leisurely walks his dog in the community..csv,Basic Movements,1
He lifted the dumbbell.csv,Sports Movements,1
He lifts one leg backward while standing..csv,Basic Movements,3
"He lightly touched the ground with his tiptoes, his body gracefully leaped up, completing a perfect jump..csv",Basic Movements,1
"He likes to thump his chest when bragging, looking like he can do anything.csv",Uncategorized,0
"He lingered at the doorway, seemingly hesitating whether to go in.csv",Daily-Life & Household Movements,1
He lingered for a moment in front of the small shop in the ancient town.csv,Daily-Life & Household Movements,1
He lit the match.csv,Uncategorized,0
He looked around to make sure no one noticed his actions.csv,Uncategorized,0
He looked around.csv,Uncategorized,0
He looks up 45 degrees.csv,Uncategorized,0
He lost the wallet.csv,Daily-Life & Household Movements,1
He lost the war disarmed and surrendered.csv,Uncategorized,0
He lowered his head.csv,Basic Movements,1
He lowered the brim of his hat to avoid the glaring sunlight.csv,Daily-Life & Household Movements,1
He made a cup of milk powder.csv,Daily-Life & Household Movements,1
He made a sarcastic gesture towards the other party.csv,Social/Expressive Movements,1
"He made an exaggerated surprised expression, his eyes and mouth wide open, as if he saw an alien.csv",Object/Tool-Use Movements,1
He made noise in the library and was expelled by the librarian.csv,Occupational/Work Movements,1
He made up his mind to repent and correct his mistakes.csv,Uncategorized,0
He makes amends for the harm to others with apologies and gifts.csv,Social/Expressive Movements,2
He mashed the plants to prepare an ointment.csv,Daily-Life & Household Movements,1
He massages the patient.csv,Medical/Care/Safety Movements,1
He measured the height of the table with a ruler.csv,Daily-Life & Household Movements,1
He measures fabric with a ruler to tailor clothes.csv,Daily-Life & Household Movements,1
He met a friend on the street and exchanged a few words.csv,Uncategorized,0
He mixed the eggs into the flour and kept kneading the dough.csv,Object/Tool-Use Movements,1
He mocks other people_s antics.csv,Uncategorized,0
He mounted a landscape painting with paper pulp.csv,Object/Tool-Use Movements,1
He moved the table to the corner and adjusted the level as needed.csv,Daily-Life & Household Movements,1
"He moves his body lightly and floatily, his arms gently swaying, imitating a ghost..csv",Object/Tool-Use Movements,1
He nailed the drawing board firmly on the shelf..csv,Uncategorized,0
He nailed the hook firmly to the wall.csv,Uncategorized,0
He nailed the nails into the wooden board.csv,Uncategorized,0
"He nervously rubbed his hands, and tiny beads of sweat seeped from his forehead.csv",Uncategorized,0
He nodded and agreed to this request.csv,Social/Expressive Movements,2
He not only gave a thumbs up but also frequently clapped while extolling the star_s talent.csv,Uncategorized,0
He often makes fun of the servant_s clothes at home(1).csv,Daily-Life & Household Movements,2
He opened his arms to embrace his long lost friend.csv,Object/Tool-Use Movements,1
"He opened the beer bottle, drinking in big gulps.csv",Daily-Life & Household Movements,1
He opened the door and stepped into the classroom.csv,Daily-Life & Household Movements,2
He opened the plastic bag and started packing the items.csv,Daily-Life & Household Movements,1
He opened the window to let the smoke in the room dissipate as quickly as possible.csv,Daily-Life & Household Movements,1
He opens the beer bottle.csv,Daily-Life & Household Movements,1
"He originally wanted to make a cool turn, but his steps got messed up, and he finally steadied himself with an awkward stumble.csv",Basic Movements,2
"He paced back and forth, considering for a long time.csv",Uncategorized,0
"He paced back and forth, worrying how to solve this matter..csv",Uncategorized,0
He paints the exterior wall.csv,Uncategorized,0
He parked the bicycle under the tree shade.csv,Uncategorized,0
"He patted his forehead, indicating annoyance.csv",Uncategorized,0
"He patted his stomach, indicating he was already full.csv",Uncategorized,0
He patted the dirt off his body.csv,Uncategorized,0
"He patted the tabletop with his palm, signaling everyone to quiet down.csv",Daily-Life & Household Movements,1
He paused in front of that painting and stayed for a long time.csv,Daily-Life & Household Movements,1
He peeped at the neighbor_s every move through the gap in the curtain.csv,Object/Tool-Use Movements,1
"He performs as the _Noodle Man_ soft and boneless, then transforms into the _Robot_ stiff and clumsy..csv",Uncategorized,0
"He performs drinking water, but deliberately raises the cup above his head, then pours the water into his mouth like a fountain..csv",Daily-Life & Household Movements,2
He personally feeds his pet dog every day.csv,Uncategorized,0
He picked up a stick and chased away the pheasants that intruded into the crops..csv,Object/Tool-Use Movements,2
He picked up the basin and splashed water out.csv,Object/Tool-Use Movements,2
He picked up the broom to clean the room.csv,Object/Tool-Use Movements,4
He picked up the knife and cut the cake into even small pieces.csv,Object/Tool-Use Movements,4
He picked up the razor and shaved the beard off his face.csv,Object/Tool-Use Movements,2
He picked up the ruler and was measuring the TV_s size.csv,Object/Tool-Use Movements,2
He picked up the trophy from the shelf and wiped away the dust with a cloth.csv,Object/Tool-Use Movements,4
He picked up the vase and smashed it forcefully.csv,Object/Tool-Use Movements,3
He picked up the watering can to water the sapling.csv,Object/Tool-Use Movements,2
He piled the goods in the corner.csv,Uncategorized,0
He pinched his nose in disgust and quickly walked past that reeking garbage heap.csv,Daily-Life & Household Movements,2
He placed all his belongings in the new room.csv,Daily-Life & Household Movements,1
He placed the doll on the balcony.csv,Object/Tool-Use Movements,1
He placed the newly bought writing brush on the table.csv,Object/Tool-Use Movements,2
He placed two tables side by side..csv,Daily-Life & Household Movements,1
"He pointed a finger at the other person in the crowd, and pushed through the crowd to chase forward..csv",Object/Tool-Use Movements,1
He pointed a pistol at the other person_s head to rob valuables.csv,Uncategorized,0
He pointed at the other party and sternly warned..csv,Uncategorized,0
He pointed out the stain on the wall with his finger.csv,Uncategorized,0
He pointed out the stain on the wall with his finger_1.csv,Uncategorized,0
He posted a lost and found notice on the bulletin board.csv,Uncategorized,0
He posted the poster on the library notice board.csv,Uncategorized,0
"He pounded on that tightly closed door, yearning to go out.csv",Daily-Life & Household Movements,2
He poured the water from the bottle into the flowerpot to replenish the water..csv,Daily-Life & Household Movements,3
He poured the water out of the pot.csv,Daily-Life & Household Movements,1
He pours water into the cup.csv,Daily-Life & Household Movements,2
"He practiced calligraphy stroke by stroke, following the teacher_s demonstration..csv",Occupational/Work Movements,1
He pressed against the wall to hide himself from being exposed.csv,Uncategorized,0
He privately accepted bribes and shielded criminals.csv,Uncategorized,0
"He propped one hand on his lower back, bent over, and extended his index finger to provoke the other party..csv",Basic Movements,1
He pulled out three tissues.csv,Object/Tool-Use Movements,1
"He pulled several banknotes from his wallet, handed them to the cashier, and paid the bill..csv",Object/Tool-Use Movements,2
He pulled the rope at the flag-raising ceremony watching the flag rise high into the sky.csv,Object/Tool-Use Movements,1
He pulls the rope in the tug-of-war competition.csv,Object/Tool-Use Movements,1
He punched the other person..csv,Uncategorized,0
He pursues the criminal.csv,Uncategorized,0
He pushed open the door with his elbows and closed it with his feet because his hands were holding a tray..csv,Object/Tool-Use Movements,5
"He pushed open the door, video called a friend on his phone, and virtually toured the room.csv",Daily-Life & Household Movements,2
He put files and pens into the folder and stationery box.csv,Object/Tool-Use Movements,1
"He put his foot into the river, walking tentatively to test the water_s depth..csv",Basic Movements,2
He put on clothes.csv,Daily-Life & Household Movements,1
He put on his hat.csv,Daily-Life & Household Movements,1
"He put on that old straw hat, ready to go out.csv",Daily-Life & Household Movements,1
He put several newly bought chickens into the refrigerator to freeze.csv,Object/Tool-Use Movements,1
He put the beef jerky on the shelf to air dry and weather.csv,Object/Tool-Use Movements,1
He put the collected herbs into the jar and brewed medicinal wine.csv,Object/Tool-Use Movements,1
He put the fruit into the container and hand-made a bottle of fruit tea.csv,Daily-Life & Household Movements,1
He put the herbs into the mortar and gently ground them with the pestle.csv,Object/Tool-Use Movements,1
He put the lid on the pot.csv,Object/Tool-Use Movements,1
He put the peeled orange segment into his mouth and shivered from the sourness.csv,Object/Tool-Use Movements,1
He put the water cup on the table.csv,Daily-Life & Household Movements,3
"He quickly pressed the elevator button, anxiously waiting for the door to open.csv",Daily-Life & Household Movements,1
"He quickly stuffed the document into the drawer, covered it with a pile of clutter, to conceal important documents from being discovered by others..csv",Object/Tool-Use Movements,1
"He quietly approached the window, eavesdropping on the conversation inside.csv",Uncategorized,0
He quietly hid the key under the flowerpot.csv,Daily-Life & Household Movements,1
He raised a single arm while warming up.csv,Uncategorized,0
He raised his arm and threw his hat into the air.csv,Daily-Life & Household Movements,1
He raised his arms and twisted his upper body while working out..csv,Uncategorized,0
He raised his foot and stepped into the house.csv,Basic Movements,1
He raised his hand forward.csv,Uncategorized,0
He raised his pistol and accurately shot the distant target.csv,Combat & Tactical Movements,1
He raised his wine glass and drank heartily under the moonlight.csv,Uncategorized,0
He raised the sails and prepared to go to sea.csv,Uncategorized,0
He raised the torch to the sky to send out a distress signal.csv,Uncategorized,0
He rammed the door with his shoulder.csv,Daily-Life & Household Movements,1
He ran over from a distance then turned around and quickly ran back.csv,Basic Movements,1
"He ran, looking back and shouting for his companions to follow..csv",Uncategorized,0
"He reached for the book on the top shelf, stood on tiptoe, his fingers barely touching the spine, and carefully took it down.csv",Daily-Life & Household Movements,1
"He reached out his hand, tightly grasped her wrist, trying to keep her from leaving.csv",Uncategorized,0
"He reached out to help the fallen old man, ensuring he safely stood up.csv",Uncategorized,0
He reached out to help the old man stand up from the chair.csv,Basic Movements,1
He received the admission letter.csv,Uncategorized,0
He received the trophy he had won with both hands.csv,Object/Tool-Use Movements,1
He receives letters.csv,Uncategorized,0
He recommended a newly opened Japanese restaurant to his friends.csv,Object/Tool-Use Movements,1
He reduced the package_s volume.csv,Uncategorized,0
He regretted wasting so much time.csv,Uncategorized,0
"He released the bowling ball from his hand, striking the target pins..csv",Social/Expressive Movements,1
He repeatedly promised to complete the task.csv,Uncategorized,0
He repented and confessed to the organization.csv,Uncategorized,0
He replaced the old brooch on his clothes with a new one.csv,Object/Tool-Use Movements,3
He resented the informer.csv,Uncategorized,0
He resented the other party climbing over the railing and sternly reprimanded them.csv,Social/Expressive Movements,1
"He rested his hands on the balcony railing, leaning back and watching the clouds.csv",Basic Movements,1
He retreated three steps.csv,Basic Movements,2
"He revealed the bomb at his waist, ready for martyrdom..csv",Uncategorized,0
"He roared angrily, his hands tightly clenched into fists, his body leaning forward as if about to charge forward.csv",Basic Movements,1
He rolled up his sleeves.csv,Uncategorized,0
He rolls out dumpling wrappers with a rolling pin.csv,Object/Tool-Use Movements,1
"He rubbed his hands, trying to resist the bitter cold..csv",Uncategorized,0
He rubbed his palms to absorb warmth.csv,Uncategorized,0
He runs and jumps in circles holding a torch.csv,Object/Tool-Use Movements,2
He runs like a pony.csv,Imitation/Character Movements,2
He rushed to the battlefield preparing to sacrifice himself.csv,Uncategorized,0
He salutes the national flag.csv,Social/Expressive Movements,1
He scolded the child for throwing toys around in the living room.csv,Daily-Life & Household Movements,1
He scooped up seaweed from the water.csv,Daily-Life & Household Movements,1
He sealed the fruit in the box.csv,Uncategorized,0
"He sealed the letter he had written, then handed it to the messenger.csv",Uncategorized,0
He secretly hid the toy in his pocket and appropriated it while the other children were not paying attention..csv,Uncategorized,0
"He secretly pulled his classmate_s chair away, preparing to prank him.csv",Object/Tool-Use Movements,1
He shakes the bells and performs a shamanic ritual..csv,Uncategorized,0
He shielded the sun with his hand.csv,Uncategorized,0
"He shivered as he walked down the desolate street in the cold wind, involuntarily tightening his trench coat and pulling down his hat brim..csv",Daily-Life & Household Movements,1
He shivered from the cold..csv,Uncategorized,0
"He shook his head dejectedly and helplessly, indicating he was giving up the next game..csv",Uncategorized,0
He shook his head like a rattle-drum.csv,Imitation/Character Movements,2
He shook his head three times.csv,Uncategorized,0
He shook the sack and dust scattered all over the ground.csv,Uncategorized,0
He shouldered the heavy load.csv,Uncategorized,0
He shoved the other person.csv,Uncategorized,0
He sighed helplessly..csv,Uncategorized,0
"He slammed the door shut with a bang, startling himself..csv",Daily-Life & Household Movements,1
He slammed the ledger on the table to show the other party owed him money.csv,Daily-Life & Household Movements,1
He slapped the other party.csv,Uncategorized,0
He slaughtered a duck.csv,Social/Expressive Movements,1
"He slowly approached the money on the ground, picked it up, then spread his hands, looked left and right, and exclaimed..csv",Object/Tool-Use Movements,2
"He slowly squatted down, reached out to pick up the ball from the ground and played with it in his hand.csv",Basic Movements,2
He snapped off the branches.csv,Uncategorized,0
He sneezed three times.csv,Uncategorized,0
He softly said to the customers Please follow me then turned and guided them into the restaurant.csv,Basic Movements,1
