file,category,keyword_match_score
A Boxer Furiously Punches a Sandbag During Training..csv,Sports Movements,2
A Gardener Holding a Hoe Is Loosening the Soil.csv,Object/Tool-Use Movements,3
"A Legs spread apart, arms stretched upwards, forming a peak.csv",Uncategorized,0
A Little Girl Is Singing In Front Of A Standing Microphone In KTV.csv,Dance & Performance Movements,2
A Milk Tea Barista Hand-Muddles Lemon in a Shaker Cup.csv,Occupational/Work Movements,1
A Person Flicks Someone Else_s Head.csv,Uncategorized,0
A Person Is Walking In Circles.csv,Basic Movements,2
A Person Ran Over To Join The Fun.csv,Uncategorized,0
A Person Singing While Dancing.csv,Dance & Performance Movements,1
A Person Walking to the Left.csv,Basic Movements,2
A Person Walks Counter-Clockwise.csv,Object/Tool-Use Movements,1
A Person Wearing Headphones Listening To Music.csv,Uncategorized,0
A Person Went To Clean The Blackboard And Was Choked By The Dust.csv,Daily-Life & Household Movements,1
A SWAT officer decisively shot and wounded the armed suspect during the standoff..csv,Combat & Tactical Movements,3
A ballet dancer gracefully spins on the stage.csv,Dance & Performance Movements,5
"A bartender at the bar counter proportionally pours various liquors and fruit juices into a shaker, shakes them to mix thoroughly, and makes a bottle of cocktail..csv",Object/Tool-Use Movements,2
A beggar begs from passersby with both hands..csv,Uncategorized,0
A beggar leans on a crutch and begs from passersby..csv,Basic Movements,1
"A blind person gently touches surrounding objects, trying to discern the way forward.csv",Uncategorized,0
"A bodyguard walks in front of the important person, using their body as a shield..csv",Combat & Tactical Movements,1
A boxer feints a punch in the ring.csv,Sports Movements,1
A chef at the vegetable market looks through fresh celery and picks up tomatoes to select..csv,Occupational/Work Movements,1
"A chef flattens the dough in the kitchen, preparing to make pastries..csv",Occupational/Work Movements,1
A child begs mom to go out and play.csv,Uncategorized,0
A child cannot find their mother and cries non-stop..csv,Uncategorized,0
"A child curiously stands in front of the aquarium, watching..csv",Basic Movements,1
A child excitedly pulled the newly bought toy from their backpack to show their companion..csv,Object/Tool-Use Movements,1
A child holding a paintbrush scribbling on the wall.csv,Object/Tool-Use Movements,3
A child is holding a balloon and skipping..csv,Object/Tool-Use Movements,2
"A child on the beach excitedly kicking and splashing the seawater, sending up strings of water splashes.csv",Daily-Life & Household Movements,1
A cleaner sprays disinfectant in public areas..csv,Object/Tool-Use Movements,2
A courier packs a customer_s package and labels it..csv,Uncategorized,0
"A detective holds a magnifying glass, with his hands behind his back, carefully observing as he walks..csv",Occupational/Work Movements,1
"A detective wanders around the crime scene, meticulously searching for potentially overlooked clues..csv",Occupational/Work Movements,1
A drunk man walking.csv,Basic Movements,3
A drunken man walks while drinking.csv,Basic Movements,2
"A farmer raised a flock of chickens on the farm, feeding them regularly every day..csv",Occupational/Work Movements,1
"A farmer stands on the field ridge, holding a long pipe, forcefully irrigating clear well water into the rice field..csv",Object/Tool-Use Movements,2
A firefighter is holding a fire extinguisher to put out a fire.csv,Object/Tool-Use Movements,3
"A gardener is operating a lawnmower, mowing the lawn..csv",Occupational/Work Movements,1
A gardener is weeding in the flowerbed..csv,Occupational/Work Movements,1
A group of masked men suddenly robbed the jewelry store.csv,Daily-Life & Household Movements,1
A group of thugs stormed the jewelry store and began looting precious gems from the display cases..csv,Daily-Life & Household Movements,1
A horticulturist observes the growth of green plants in the flowerbed..csv,Daily-Life & Household Movements,2
A little child holding up their pant legs and stepping in puddles on a rainy day.csv,Object/Tool-Use Movements,2
"A little child poked the hornet_s nest on the tree with a long stick, then threw the stick away and ran off scared..csv",Uncategorized,0
A little girl is blowing bubbles.csv,Uncategorized,0
A little girl is singing and dancing in KTV..csv,Dance & Performance Movements,2
A little girl runs while playing with a bubble machine.csv,Basic Movements,1
A masked man suddenly rushed out from a dark alley and robbed a passerby.csv,Uncategorized,0
A middle-aged man lights a cigarette with a match.csv,Uncategorized,0
A middle-aged man stands lighting a cigarette for others..csv,Basic Movements,1
A middle-aged man threw the cigarette butt on the ground and stamped it out..csv,Uncategorized,0
A milk tea maker communicates with customers to understand their taste preferences and provide recommendations and suggestions.csv,Basic Movements,1
A milk tea maker made an ice cream.csv,Uncategorized,0
A nurse helps a patient with limited mobility in the hospital..csv,Occupational/Work Movements,1
A nurse is caring for an injured patient.csv,Medical/Care/Safety Movements,2
A nurse takes a patient_s temperature.csv,Occupational/Work Movements,1
A person attacks an enemy once with a sword and shield..csv,Combat & Tactical Movements,2
A person attacks an enemy once with a two-handed sword..csv,Combat & Tactical Movements,2
A person attacks an enemy with a fist once..csv,Combat & Tactical Movements,2
A person attacks an enemy with an axe.csv,Combat & Tactical Movements,2
A person attacks the enemy three times with a rocket launcher.csv,Combat & Tactical Movements,2
A person attacks the enemy three times with a sword and shield..csv,Combat & Tactical Movements,2
A person attacks the enemy with a baseball bat once.csv,Combat & Tactical Movements,2
A person choosing gifts in a gift shop.csv,Daily-Life & Household Movements,2
A person crossing the road.csv,Basic Movements,1
A person distributing flyers to passersby on the street.csv,Uncategorized,0
A person excitedly scratches a lottery ticket and unexpectedly wins a prize..csv,Uncategorized,0
"A person excitedly scratches a lottery ticket, then becomes very disappointed after not winning..csv",Uncategorized,0
A person goes crazy while on the phone.csv,Uncategorized,0
A person groping for the remote control on the sofa.csv,Uncategorized,0
A person grumbling while walking and talking on the phone..csv,Basic Movements,2
A person holding a dagger attacks the enemy three times.csv,Combat & Tactical Movements,2
A person holding a hammer attacks the enemy three times.csv,Object/Tool-Use Movements,3
A person holding a long sword attacks an enemy once.csv,Combat & Tactical Movements,2
A person holding a machete attacks the enemy three times.csv,Combat & Tactical Movements,2
A person holding a pistol shooting a shot.csv,Combat & Tactical Movements,2
"A person holding a rice spoon, lifting the pot lid, and scooping a bowl of rice.csv",Object/Tool-Use Movements,4
A person holding a submachine gun is strafing..csv,Object/Tool-Use Movements,2
A person in the laboratory is doing experiments and recording experimental data to ensure the accuracy of the research..csv,Uncategorized,0
A person is brushing teeth.csv,Daily-Life & Household Movements,2
A person is carrying a shoulder pole and walking forward..csv,Basic Movements,2
A person is cutting vegetables.csv,Daily-Life & Household Movements,1
A person is dancing Yangge.csv,Uncategorized,0
A person is dancing.csv,Uncategorized,0
A person is hand grinding coffee..csv,Uncategorized,0
A person is jogging.csv,Uncategorized,0
A person is jumping up and down in place.csv,Object/Tool-Use Movements,1
A person is laughing heartily.csv,Social/Expressive Movements,1
A person is making the bed.csv,Uncategorized,0
A person is nervously crossing a log bridge.csv,Basic Movements,1
A person is nervously crossing a log bridge_1.csv,Basic Movements,1
A person is performing a drunkard_s walk.csv,Basic Movements,2
A person is playing Rubik_s Cube.csv,Uncategorized,0
A person is playing a big drum.csv,Uncategorized,0
A person is playing the trombone.csv,Uncategorized,0
A person is playing the trombone_1.csv,Uncategorized,0
A person is playing the trumpet.csv,Uncategorized,0
A person is playing the viola.csv,Uncategorized,0
A person is running in circles..csv,Basic Movements,2
A person is scrubbing clothes.csv,Daily-Life & Household Movements,1
A person is selecting a bag to wear in front of the mirror..csv,Daily-Life & Household Movements,1
A person is shaking their head.csv,Uncategorized,0
A person is singing and dancing..csv,Dance & Performance Movements,1
A person is spinning a hula hoop.csv,Uncategorized,0
A person is striking various photo poses.csv,Uncategorized,0
A person is swatting flies.csv,Combat & Tactical Movements,1
A person is throwing shot put.csv,Object/Tool-Use Movements,2
A person is treading in place with both feet..csv,Object/Tool-Use Movements,1
A person is washing dishes.csv,Daily-Life & Household Movements,2
A person is washing face.csv,Daily-Life & Household Movements,3
A person is wielding a broadsword.csv,Uncategorized,0
A person is wielding a broadsword_1.csv,Uncategorized,0
A person leaped up and threw the basketball.csv,Sports Movements,1
A person moved two steps to the left.csv,Object/Tool-Use Movements,1
"A person picks up the glasses that fell on the ground, carefully wipes them, and puts them back on..csv",Object/Tool-Use Movements,3
A person picks up the trash from the ground and throws it into the trash can..csv,Object/Tool-Use Movements,2
A person promoting products to passersby on the street.csv,Uncategorized,0
A person punches the enemy three times..csv,Combat & Tactical Movements,1
A person puts on a coat.csv,Object/Tool-Use Movements,1
A person ran a lap.csv,Uncategorized,0
A person ran five steps forward.csv,Basic Movements,1
A person runs clockwise.csv,Object/Tool-Use Movements,1
A person runs forward.csv,Basic Movements,1
A person runs to the right.csv,Basic Movements,1
A person sang their heart out while playing the guitar.csv,Uncategorized,0
"A person saw the hot pot catch fire, panicked and didn_t know what to do, wandered aimlessly, and finally put the lid on the pot..csv",Object/Tool-Use Movements,2
"A person saw the pot was on fire, quickly turned off the gas stove, and calmly poured the vegetables from the basin into the pot.csv",Daily-Life & Household Movements,1
"A person saw their friend had already arrived at the agreed location, waved, and rushed directly over..csv",Object/Tool-Use Movements,1
A person served a bowl of rice.csv,Sports Movements,1
A person shook off water droplets from their hands after washing..csv,Daily-Life & Household Movements,3
A person shoots an enemy once with a crossbow..csv,Combat & Tactical Movements,2
A person shoots the enemy three times with a bow and arrow.csv,Combat & Tactical Movements,2
A person shoots the enemy three times with a sniper rifle.csv,Combat & Tactical Movements,2
A person singing and dancing.csv,Dance & Performance Movements,1
"A person standing on a bus, their right hand holding the grab ring.csv",Object/Tool-Use Movements,2
A person standing throwing a smoke bomb.csv,Basic Movements,2
A person started to get irritable while on the phone.csv,Daily-Life & Household Movements,1
"A person stooping in a field, walking and sowing seeds.csv",Basic Movements,2
A person takes off their coat.csv,Uncategorized,0
"A person taking photos in front of a mirror, striking various poses.csv",Uncategorized,0
A person throws a hand grenade from a standing position..csv,Basic Movements,3
"A person timidly finished putting the vegetables into the hot oil pot, first slowly stepped back a few steps, then put the vegetables spilled on the table back into the pot..csv",Daily-Life & Household Movements,1
"A person timidly puts vegetables into a hot oil pot, then fearfully steps back a few paces immediately after, before slowly approaching with a spatula to carefully stir..csv",Object/Tool-Use Movements,2
"A person timidly puts vegetables into the hot oil pot, and as soon as they finish, they fearfully retreats a few steps..csv",Basic Movements,2
A person took a step to the left.csv,Basic Movements,1
A person took a step to the right.csv,Basic Movements,1
A person trying on handbags in various poses in front of the mirror.csv,Daily-Life & Household Movements,1
A person uses a dagger to attack the enemy three times.csv,Combat & Tactical Movements,2
A person walked three steps forward.csv,Basic Movements,2
A person walked three steps to the left.csv,Basic Movements,2
A person walked three steps to the right.csv,Basic Movements,2
A person walking and dribbling a basketball.csv,Sports Movements,2
A person walking and shooting with a pistol.csv,Basic Movements,2
A person walks clockwise.csv,Object/Tool-Use Movements,1
"A person_s left leg is injured, walking with crutches.csv",Basic Movements,2
A police officer is leading a police dog forward..csv,Combat & Tactical Movements,1
"A programmer stands in front of the projection screen, explaining and demonstrating research results..csv",Basic Movements,1
A sanitation worker is holding a broom and sweeping the ground.csv,Object/Tool-Use Movements,3
A scavenger bends over to pick up items.csv,Object/Tool-Use Movements,1
"A soccer player hit the volleyball with their hand, accurately passing it to their teammate..csv",Sports Movements,1
"A soldier holds a shield and a spear, defending this land from enemy intrusion..csv",Combat & Tactical Movements,2
"A soldier stands guard on the border, vigilantly observing the surrounding movements..csv",Combat & Tactical Movements,2
A soldier stands still in front of the monument.csv,Combat & Tactical Movements,1
A soldier used a machine gun to perform a series of strafing..csv,Combat & Tactical Movements,2
A stranger lured the children with snacks and took them away..csv,Uncategorized,0
A street loafer is strolling with hands in pockets..csv,Basic Movements,1
A stylish man is walking.csv,Basic Movements,2
A sudden heavy rain made passers-by quickly cover their heads with items in their hands.csv,Uncategorized,0
A thief holding a knife forced me to open the safe.csv,Object/Tool-Use Movements,4
A thug armed with a knife kidnaps a passerby..csv,Object/Tool-Use Movements,1
A tour guide at the museum is explaining the historical background of this ancient mural to the tourists.csv,Uncategorized,0
A tour guide holding a microphone explains travel tips to tourists.csv,Object/Tool-Use Movements,2
"A traffic controller stands at the intersection, directing vehicles and pedestrians safely with hand gestures.csv",Social/Expressive Movements,1
A traffic police officer raised his hand to stop a car.csv,Combat & Tactical Movements,1
A wild cat that darted out from the shadows startled him.csv,Daily-Life & Household Movements,1
"A worker is carrying a bucket, holding a putty knife, and painting the wall..csv",Object/Tool-Use Movements,5
"A worker picks up a chisel and a small hammer, carving patterns on the wood..csv",Object/Tool-Use Movements,2
A worker swings a hammer to hit a nail..csv,Occupational/Work Movements,1
"A zombie with an injured leg limps, dragging itself along..csv",Medical/Care/Safety Movements,1
"A zombie_s leg drags on the ground, the other leg limps..csv",Uncategorized,0
"Accidentally scratched his arm, he quickly tore open a band-aid and applied it to the wound.csv",Medical/Care/Safety Movements,2
Actions and reactions occur when envying others..csv,Uncategorized,0
Adrenaline is injected while standing..csv,Basic Movements,2
Affected Version.csv,Uncategorized,0
"After He Filled The Bathtub With Hot Water, He Reached Out To Touch Its Temperature.csv",Daily-Life & Household Movements,1
After I finished brushing my teeth I put the toothbrush into the tooth cup.csv,Daily-Life & Household Movements,2
"After I finished cutting vegetables, I cleaned the kitchen knife and inserted it into the knife block..csv",Object/Tool-Use Movements,4
"After I finished shaking out my top, I inserted the hanger_s hook into the sleeve and hung it up..csv",Uncategorized,0
"After I ran ten kilometers, I stopped, panting.csv",Uncategorized,0
"After I stamped the invoice, I handed it to the customer with both hands.csv",Uncategorized,0
"After a fierce argument, he helplessly waved his hand, indicating he would stop and no longer continue the dispute.csv",Object/Tool-Use Movements,2
After a long chase he leaned against the wall panting trying to calm his breathing.csv,Basic Movements,1
"After a long run, he finally stopped, bent down, hands on his knees, panting heavily, allowing his body a brief rest.csv",Basic Movements,1
"After being slapped twice, he angrily clenched his fists, held his head high, and went to settle the score..csv",Uncategorized,0
"After being startled, he involuntarily took a few steps back.csv",Basic Movements,1
"After class, the duty student put the benches on the tables and cleaned up..csv",Object/Tool-Use Movements,2
"After confirming the target, Special Forces acted swiftly and killed the terrorists.csv",Uncategorized,0
"After finishing Tai Chi, he stood up and closed the form..csv",Sports Movements,2
"After he brushed off the snow from his body outside the door, he opened the door and walked into his warm home.csv",Daily-Life & Household Movements,2
"After he opened the door, he supported his head with his hand, stood on one leg, and touched the ground with his other foot.csv",Daily-Life & Household Movements,1
"After he returned from shopping, one arm carrying a bag and the other taking off his sunglasses, he elegantly walked in.csv",Basic Movements,3
"After seriously pondering the stone material in front of him, the worker, holding a carving knife, cautiously began to carve..csv",Object/Tool-Use Movements,3
"After setting up the camera alone, a person strikes various poses..csv",Uncategorized,0
"After she picked up the glass bottle from the table, she pulled out the cork and placed it on the table.csv",Object/Tool-Use Movements,4
"After singing the birthday song for my friend, I started smearing cake on her face.csv",Dance & Performance Movements,1
"After the game, the opponents embraced each other, sincerely congratulating each other on their victory.csv",Uncategorized,0
"After the interview, he met the interviewer in the corridor and politely nodded.csv",Social/Expressive Movements,1
"After the police found the suspect, they drew their pistol, chambered a round, and pursued the criminal..csv",Combat & Tactical Movements,1
All Students Competed to Imitate the Teacher_s Calligraphy.csv,Occupational/Work Movements,1
"An elderly person at the street corner extends a trembling hand, begging passersby for loose change.csv",Uncategorized,0
An elementary school student unloads their heavy backpack onto the desk backwards.csv,Daily-Life & Household Movements,1
"An epilepsy patient trembles forward, leaning on crutches..csv",Medical/Care/Safety Movements,1
"An old farmer carries a water bucket on his shoulder, walks to the field, scoops up water, and waters the seedlings..csv",Occupational/Work Movements,1
"An old farmer is wielding his plow in the morning light, plowing the fields..csv",Occupational/Work Movements,1
An old farmer walks home carrying a heavy load of paddy..csv,Occupational/Work Movements,1
An old man carrying a birdcage leisurely strolls in the park.csv,Object/Tool-Use Movements,2
Angry Neighbors Cursing Each Other Across the Wall.csv,Social/Expressive Movements,1
Applying a bandage while standing..csv,Basic Movements,2
"Armed and on Guard, Alert to the Surroundings.csv",Combat & Tactical Movements,1
Artist boasts about their work at the gallery opening.csv,Occupational/Work Movements,1
"As he was opening the door, the key in his hand accidentally dropped, and he bent down to pick it up.csv",Object/Tool-Use Movements,2
"As soon as school is out, the child sprints home with their schoolbag.csv",Daily-Life & Household Movements,3
"As soon as she saw the bus was about to depart, she immediately ran after it.csv",Uncategorized,0
"As soon as the children saw the ice cream truck, they excitedly gathered around.csv",Uncategorized,0
As soon as the teacher asked a question the students enthusiastically raised their hands to speak.csv,Occupational/Work Movements,1
"As soon as they heard the supermarket_s rice was half price, the crowd immediately began to scramble.csv",Uncategorized,0
"As the chef was busy in the kitchen, the oil in the pot overheated, suddenly causing the food to catch fire, and he quickly put the lid on the pot..csv",Object/Tool-Use Movements,2
"As the coach_s whistle blew, the players quickly gathered in the center of the field.csv",Uncategorized,0
"As the whistle blew, the athletes burst forth.csv",Uncategorized,0
"As the workers shoveled, dust flew everywhere.csv",Occupational/Work Movements,1
"At the ball, she lifted her skirt, dancing and spinning..csv",Daily-Life & Household Movements,1
"At the concert, the main performer is singing folk music with great emotion and expression..csv",Dance & Performance Movements,1
"At the concert, the main performer sings hip-hop music while holding a microphone and stepping to the beat..csv",Object/Tool-Use Movements,2
"At the funeral, family and friends stood silently in tribute.csv",Uncategorized,0
"At the wedding, the groom raised his hand to lift the bride_s veil.csv",Daily-Life & Household Movements,1
Athlete Jumps Over Hurdle.csv,Basic Movements,1
Athletes Preparing in the Warm-up Area for the Upcoming Competition.csv,Uncategorized,0
Athletes pick up water bottles and drink deeply.csv,Daily-Life & Household Movements,2
Athletes warm up and activate their muscles..csv,Uncategorized,0
Aunt Zhang drove away the little birds pecking at flowers in the garden.csv,Daily-Life & Household Movements,1
Aunt Zhang shooed away the little bird pecking flowers in the garden.csv,Daily-Life & Household Movements,1
Balala the Fairies Transform..csv,Uncategorized,0
"Because he returned home too late, he tiptoed quietly as he opened the door and entered the room.csv",Daily-Life & Household Movements,3
"Before he picked up the money on the ground, he first took out his phone to take a picture.csv",Object/Tool-Use Movements,2
"Before the exam, Xiaohua nervously scratched her scalp, trying to calm herself down.csv",Uncategorized,0
Both hands make a heart.csv,Uncategorized,0
Boxer Does Some Warm-up Exercises Before a Match.csv,Sports Movements,2
Boxer shows his impressive state to the audience after putting on gloves.csv,Sports Movements,1
Boxing Coach Simulates Opponent_s Attack Movements.csv,Sports Movements,1
Brother Suave draws circles to curse you..csv,Uncategorized,0
Bullies always find opportunities to bully the weak.csv,Uncategorized,0
C Forming a curved _C_ shape.csv,Uncategorized,0
Caregiver gives patient a sponge bath.csv,Medical/Care/Safety Movements,4
Carpenter uses sandpaper to sand cut edges.csv,Occupational/Work Movements,1
Chef Li is skillfully kneading the dough in the kitchen.csv,Occupational/Work Movements,1
"Chef Li puts the beef chunks into the stew pot, adds an appropriate amount of water, and prepares to start stewing.csv",Object/Tool-Use Movements,2
Chef cuts dough sheets into long thin noodles.csv,Occupational/Work Movements,1
Chen Han closed the door.csv,Daily-Life & Household Movements,1
Child splashes water with feet.csv,Daily-Life & Household Movements,1
Children Often Go Home Together After School.csv,Daily-Life & Household Movements,1
Children are catching butterflies.csv,Object/Tool-Use Movements,1
Children are chasing and playing with each other in the park.csv,Uncategorized,0
Children are happily jumping on the playground.csv,Basic Movements,1
Children are laughingly running and chasing in the park.csv,Basic Movements,2
Children are passing the basketball on the playground with good teamwork.csv,Sports Movements,1
Children are stirring wet sand in the sandbox.csv,Object/Tool-Use Movements,1
"Children excitedly scattering petals, welcoming the bride and groom_s entrance.csv",Daily-Life & Household Movements,1
Children happily kicking a ball to each other in the park.csv,Uncategorized,0
Children playing the role of Ultraman in the game.csv,Uncategorized,0
"Clean measuring cups, measuring spoons, and other various tools when making milk tea..csv",Object/Tool-Use Movements,2
"Collaborative actions in a simulated tactical team, such as alternating cover and advance.csv",Combat & Tactical Movements,1
Construction Worker Pushes Wheelbarrow.csv,Occupational/Work Movements,2
Construction workers pull a rope.csv,Occupational/Work Movements,2
Construction workers use safety belts to secure their bodies..csv,Occupational/Work Movements,2
Continuously taking pictures of flowers with a phone.csv,Daily-Life & Household Movements,1
Customer asks sales assistant about product price..csv,Occupational/Work Movements,1
Customer complains about salesperson.csv,Occupational/Work Movements,1
Customers Are Comparing Products.csv,Uncategorized,0
"Deliberately striking a cool pose, but my reflection in the mirror is foolishly grinning.csv",Uncategorized,0
Demonstrating taking a nearby person_s hat and putting it on one_s own head..csv,Daily-Life & Household Movements,1
"Doctors wear protective suits, masks, and gloves to ensure full protection before entering the infectious disease ward..csv",Occupational/Work Movements,1
"During a heated argument, he physically and verbally abused the other party.csv",Uncategorized,0
